{
  "artifacts": [
    "research/research_os/artifacts/FRONTIER-EVENT-DOCUMENT-DISTINCT-MECHANISM-012/oracle-worker/document_or_fundamental_research.json"
  ],
  "authority_assertion": {
    "economic_experiment_performed": false,
    "live_trading_performed": false,
    "prospective_observation_performed": false,
    "real_capital_used": false
  },
  "completed_at": "2026-10-20T19:20:22Z",
  "evidence_refs": [
    "research/research_os/events/FRONTIER-EVENT-DOCUMENT-DISTINCT-MECHANISM-012/FRONTIER-EVENT-DOCUMENT-DISTINCT-MECHANISM-012-g2-35ce73d019c9-002.json"
  ],
  "input_head": "e5ce768c8806e8ab261b466b83ea43a8c9856c11",
  "lease_generation": 2,
  "receipt_id": "FRONTIER-EVENT-DOCUMENT-DISTINCT-MECHANISM-012-g2-35ce73d019c9",
  "session_id": "FRONTIER-EVENT-DOCUMENT-DISTINCT-MECHANISM-012-g2-35ce73d019c9",
  "started_at": "2026-10-20T19:20:15Z",
  "status": "BLOCKED",
  "summary": "document_or_fundamental_research: BLOCKED; task=BLOCKED; release=a67ffec48fff895d5edc42171855e2213e49cf0d",
  "task_id": "FRONTIER-EVENT-DOCUMENT-DISTINCT-MECHANISM-012",
  "worker_id": "oracle-research.fundamental_events"
}
