{
  "artifacts": [
    "research/research_os/artifacts/FRONTIER-INSTITUTIONAL-FLOW-DISTINCT-MECHANISM-006/oracle-worker/legacy_duplicate_check.json"
  ],
  "authority_assertion": {
    "economic_experiment_performed": false,
    "live_trading_performed": false,
    "prospective_observation_performed": false,
    "real_capital_used": false
  },
  "completed_at": "2026-10-20T09:30:29Z",
  "evidence_refs": [
    "research/research_os/events/FRONTIER-INSTITUTIONAL-FLOW-DISTINCT-MECHANISM-006/FRONTIER-INSTITUTIONAL-FLOW-DISTINCT-MECHANISM-006-g1-e685ac32fd8e-002.json"
  ],
  "input_head": "fd01cf077ea33fd39841b7ff443069963940125c",
  "lease_generation": 1,
  "receipt_id": "FRONTIER-INSTITUTIONAL-FLOW-DISTINCT-MECHANISM-006-g1-e685ac32fd8e",
  "session_id": "FRONTIER-INSTITUTIONAL-FLOW-DISTINCT-MECHANISM-006-g1-e685ac32fd8e",
  "started_at": "2026-10-20T09:30:24Z",
  "status": "COMPLETE",
  "summary": "legacy_duplicate_check: CONTINUE; task=READY; release=f3943830e20b05d926d3013501573b8b21fdace7",
  "task_id": "FRONTIER-INSTITUTIONAL-FLOW-DISTINCT-MECHANISM-006",
  "worker_id": "oracle-research-v1.market_discovery"
}
